<!DOCTYPE dataset SYSTEM "dataset.dtd">
<dataset>

    <REVISION_TYPE REVISION_TYPE_ID="CREATE" DISPLAY_NAME="Create"/>
    <REVISION_TYPE REVISION_TYPE_ID="UPDATE" DISPLAY_NAME="Update"/>
    <REVISION_TYPE REVISION_TYPE_ID="DELETE" DISPLAY_NAME="Delete"/>
    <REVISION_TYPE REVISION_TYPE_ID="RESURRECT" DISPLAY_NAME="Resurrect"/>

    <RULE_ACTION RULE_ACTION_ID="ignore" DISPLAY_NAME="Ignore"/>
    <RULE_ACTION RULE_ACTION_ID="warn" DISPLAY_NAME="Warn"/>
    <RULE_ACTION RULE_ACTION_ID="clean" DISPLAY_NAME="Clean"/>
    <RULE_ACTION RULE_ACTION_ID="quarantine" DISPLAY_NAME="Quarantine"/>

</dataset>